<?xml version="1.0" encoding="UTF-8" ?>
<eks-source xmlns:xsi="http://www.w3.org/2001/XMLSchema-instance" xsi:noNamespaceSchemaLocation="../../../schema.xsd">
    <metadata>
        <name>ReadNovelFull</name>
        <base-url>https://readnovelfull.com</base-url>
        <version>1.1.0</version>
        <language>en</language>
        <novel-status-map>
            <ongoing>onGoing</ongoing>
            <completed>Completed</completed>
        </novel-status-map>
    </metadata>

    <discover>
        <novel-list id="trending" url="/">
            Array.from(document.querySelectorAll('#index-novel-hot > div.index-novel > div.item'), item =>
            {
            return {
            title: item.querySelector('.title h3').textContent.trim(),
            cover: item.querySelector('img').src,
            link: item.querySelector('a').href
            };
            });
        </novel-list>
        <novel-list id="most-popular" url="/novel-list/most-popular-novel">
            Array.from(document.querySelectorAll('#list-page > .col-novel-main.archive .row'), item =>
            {
            return {
            title: item.querySelector('.novel-title').textContent.trim(),
            cover: item.querySelector('.cover').src,
            link: item.querySelector('a').href
            };
            });
        </novel-list>
        <novel-list id="recently-updated" url="/novel-list/latest-release-novel">
            Array.from(document.querySelectorAll('#list-page > .col-novel-main.archive .row'), item => {

            return {
            title: item.querySelector('.novel-title').textContent.trim(),
            cover: item.querySelector('.cover').src,
            link: item.querySelector('a').href,
            };
            });
        </novel-list>
    </discover>
</eks-source>